{
  "run_id": "vr-973a8ae7",
  "domain": "autoexpress.co.uk",
  "ran_at": "2026-10-30T06:49:21.209Z",
  "claims_in": 4,
  "kept": [
    "c1",
    "c2",
    "c3",
    "c4"
  ],
  "tagged_company_claims": [],
  "removed": [
    {
      "text": "Most of that agent traffic earns nothing today.",
      "reason": "unmarked_factual_sentence"
    }
  ]
}
